recipeName,ingridents,instructions,dishImg,recipeType
freanch toast,"2 פרוסות לחם, 1 ביצה, 1/4 כוס חלב, 1 כף סוכר, 1 כף קינמון, מייפל להגשה","מערבבים היטב את החומרים בקערה עם בסיס שטוח. מחממים את החמאה במחבת. טובלים את פורוסות הלחם בבלילה, משני הצדדים. מטגנים משני צידי הלחם, ומגישים חם. מומלץ להגיש מעל עם סירופ מייפל ופירות העונה :) ",https://chefjeanpierre.com/wp-content/uploads/2021/12/THUMBNAIL-FRENCH-TOAST.jpg,Dinner
omelet,"4 ביצים, תבלינים, פטריות/ עגבניות/ בצל לפי הטעם, גבינה צהובה",טורפים את הביצים יחד עם המלח והפלפל. מחממים מחבת עם שמן זית וטגנים את הביצים 2-3 דק על להבה בינונית עד ששולי החביתה מתייצבים. מפזרים פטריות ולפי המצרכים הקיימים על מחצית מהחביתה. מניחים מעל פרוסת גבינה צהובה ומקפלים את החביתה לשתיים. מבשלים עוד כ-2 דק' על להבה נמוכה. ,https://www.thespruceeats.com/thmb/jE-PesfSjhsGS3CFBXIQNu_1tqo=/1500x0/filters:no_upscale():max_bytes(150000):strip_icc()/dinner-omelet-480277-hero-01-84a5af20b08440598a2b5b662f2e5cbe.jpg,Dinner
yogurt,"גביע יוגורט לבחירתכם, פירות העונה, גרנולה, סירופ (לבחירה)",שופכים את היוגורט לקערה רחבה ונוחה. חותכים את הפירות לפי הגודל הרצוי. מפזרים את הפירות והגרנולה מעל ומגישים :),https://domf5oio6qrcr.cloudfront.net/medialibrary/4932/w1217g16207256413097.jpg,Breakfast
pasta,"1 חבילת ספגטי, 2 בצלים, 1/2 כוס שמן, שיני שום כתושות, 2 קופסאות קטנות של רסק עגבניות, תבלינים- פפריקה כמון פלפל שחור ומלח, 1/2 קופסא עגבניות מרוסקות, 1 כוס מים","יוצקים את השמן לסיר רחב. מטגנים את הבצל עם מעט מלח עד להזהבה. מוסיפים את השום הכתוב ומטגנים כחצי דקה נוספת. מוסיפים את רסק העגבניות והתבלינים ומערבבים. מביאים לרתיחה ולאחר מכן ממשיכים לבשל על אש נמוכה. מבשלים את הספגטי במים רוחים ומומלחים. שופכים את הרוטב לספגטי, מטגנים עוד כ2-3 דק' ומגישים.",https://www.archanaskitchen.com/images/archanaskitchen/10-Brands/DelMonte-KidsRecipes/Spaghetti_Pasta_Recipe_In_Creamy_Tomato_Sauce_-_Kids_Recipes_Made_With_Del_Monte-3.jpg,Lunch
shaksuka,"4 שיני שום קצוצות, 1 קופסת שימורי עגבניות קלופות/ 4 עגבניות אמיתיות, כף רסק עגבניות, תבלינים- פפריקה מתוקה מלח ופלפל, פלפל חריף (לא חובה), 4-6 ביצים, עלי בזיליקום!","מחממים מחבת עמוקה עם שמן ומטגנים בה את השום. מוסיפים את העגבניות מהקופסא/ החתוכות, מכסים ומבשלים עד שהעגבניות מתרככות ונמסות. מוסיפים את רסק העגבניות והתבלינים. במקביל מטגנים במחבת פלפל, מסירים את הקליפה שתתקלף, קוצצים ומצרפים לעגבניות. מבשלים עם כיסוי חלקי עד שיתאדו כל הנוזלים. טוענים ומוסיפים תיבול כנדרש. מוסיפים את הביצים ומבשלים לפי מידת העשייה הרצוי. מגישים :)",https://d3o5sihylz93ps.cloudfront.net/wp-content/uploads/2020/01/15145107/14.jpg,Breakfast
